### ISSUE TITLE
Unexpected network activity from avax binary

### ISSUE THREAD

**Issue by mark-liu** [ava-labs/avalanchego#1768]
**Describe the bug**
Recently I discovered some unusual network activity flagged by the firewall coming from my Avax node (v1.10.5). It was sending SYN packets to a 10.140.0.11:9651 (different subnet) a host that doesn't exist. The Avax node is on 10.4.20.0/24 range.

First to confirm it is coming from AVAX:
```sudo tcpdump -n host 10.140.0.11
tcpdump: verbose output suppressed, use -v[v]... for full protocol decode
listening on eth0, link-type EN10MB (Ethernet), snapshot length 262144 bytes
23:26:06.727567 IP 10.4.20.127.34618 > 10.140.0.11.9651: Flags [S], seq 1669040826, win 64240, options [mss 1460,sackOK,TS val 2519675572 ecr 0,nop,wscale 7], length 0
```

Used LSOF to find the processes
```
COMMAND      PID USER   FD   TYPE   DEVICE SIZE/OFF NODE NAME
docker-pr 215439 root    4u  IPv4 26807249      0t0  TCP *:9651 (LISTEN)
docker-pr 215446 root    4u  IPv6 26813708      0t0  TCP *:9651 (LISTEN)
```

Here are the commands of those processes
```
/usr/bin/docker-proxy -proto tcp -host-ip 0.0.0.0 -host-port 9651 -container-ip 172.21.0.2 -container-port 9651
/usr/bin/docker-proxy -proto tcp -host-ip :: -host-port 9651 -container-ip 172.21.0.2 -container-port 9651
```

Traced it down to the avax container, there is only 1 container on this server. There is nothing else running on this server.
```
docker inspect -f '{{.Name}} - {{range .NetworkSettings.Networks}}{{.IPAddress}}{{end}}' $(docker ps -aq)
/avax - 172.21.0.2
```

It is sending SYN packets to 9651:
```
23:44:19.249457 IP 10.4.20.127.46596 > 10.140.0.11.9651: Flags [S], seq 2430768877, win 64240, options [mss 1460,sackOK,TS val 2520768094 ecr 0,nop,wscale 7], length 0
0x0000:  4500 003c 9f57 4000 3f06 734b 0a04 147f  E..<.W@.?.sK....
0x0010:  0a8c 000b b604 25b3 90e2 96ed 0000 0000  ......%.........
0x0020:  a002 faf0 2948 0000 0204 05b4 0402 080a  ....)H..........
0x0030:  963f de5e 0000 0000 0103 0307            .?.^........
23:44:20.269411 IP 10.4.20.127.46596 > 10.140.0.11.9651: Flags [S], seq 2430768877, win 64240, options [mss 1460,sackOK,TS val 2520769114 ecr 0,nop,wscale 7], length 0
0x0000:  4500 003c 9f58 4000 3f06 734a 0a04 147f  E..<.X@.?.sJ....
0x0010:  0a8c 000b b604 25b3 90e2 96ed 0000 0000  ......%.........
0x0020:  a002 faf0 2948 0000 0204 05b4 0402 080a  ....)H..........
0x0030:  963f e25a 0000 0000 0103 0307            .?.Z........
```

Looked inside the container to look for any traces of `10.140.0.11` in logs, configs or otherwise.
```
grep -iR "10.140.0.11" *
grep: db/mainnet/v1.4.5/2995771.log: No such file or directory
```

FYI I also checked the following, can provide logs privately if required. 
* IP table rules - all clear and no references to `10.140.0.11/20` range
* Routes - all clear and no references to `10.140.0.11/20` range
* Docker networking - all clear and no references to `10.140.0.11/20` range

These are all the IPs that main.log contained.
```
grep -oE "\b([0-9]{1,3}\.){3}[0-9]{1,3}\b" * | sort | uniq -c
20 main.log:0.0.0.0
  11 main.log:10.4.20.127 (itself)
   3 main.log:122.248.199.127
   4 main.log:122.248.200.212
   3 main.log:127.0.0.1
   1 main.log:13.244.155.170
   1 main.log:13.244.47.224
   4 main.log:15.188.9.42
   1 main.log:15.207.11.193
   3 main.log:172.18.0.2
   2 main.log:18.162.129.129
   3 main.log:18.162.161.230
   2 main.log:18.202.190.40
   4 main.log:18.229.206.191
  27 main.log:213.168.227.60
   1 main.log:3.104.107.241
   1 main.log:3.106.25.139
   5 main.log:3.128.138.36
   2 main.log:3.21.38.33
   1 main.log:3.34.221.73
   2 main.log:52.30.9.211
   2 main.log:52.47.181.114
   1 main.log:52.79.47.77
   3 main.log:54.185.87.50
   3 main.log:54.93.182.129
   4 main.log:54.94.43.49
```

**To Reproduce**
This behaviour survives pod restarts. It sends pretty consistently
```
01:13:26.692457 IP 10.4.20.127.53498 > 10.140.0.11.9651: Flags [S], seq 870152030, win 64240, options [mss 1460,sackOK,TS val 3652297840 ecr 0,nop,wscale 7], length 0
01:13:27.693471 IP 10.4.20.127.53498 > 10.140.0.11.9651: Flags [S], seq 870152030, win 64240, options [mss 1460,sackOK,TS val 3652298841 ecr 0,nop,wscale 7], length 0
01:13:29.709422 IP 10.4.20.127.53498 > 10.140.0.11.9651: Flags [S], seq 870152030, win 64240, options [mss 1460,sackOK,TS val 3652300857 ecr 0,nop,wscale 7], length 0
01:13:33.869472 IP 10.4.20.127.53498 > 10.140.0.11.9651: Flags [S], seq 870152030, win 64240, options [mss 1460,sackOK,TS val 3652305017 ecr 0,nop,wscale 7], length 0
01:13:42.061451 IP 10.4.20.127.53498 > 10.140.0.11.9651: Flags [S], seq 870152030, win 64240, options [mss 1460,sackOK,TS val 3652313209 ecr 0,nop,wscale 7], length 0
01:14:50.065216 IP 10.4.20.127.53494 > 10.140.0.11.9651: Flags [S], seq 3062495518, win 64240, options [mss 1460,sackOK,TS val 3652381213 ecr 0,nop,wscale 7], length 0
01:14:51.085466 IP 10.4.20.127.53494 > 10.140.0.11.9651: Flags [S], seq 3062495518, win 64240, options [mss 1460,sackOK,TS val 3652382233 ecr 0,nop,wscale 7], length 0
01:14:53.101430 IP 10.4.20.127.53494 > 10.140.0.11.9651: Flags [S], seq 3062495518, win 64240, options [mss 1460,sackOK,TS val 3652384249 ecr 0,nop,wscale 7], length 0
01:14:57.325576 IP 10.4.20.127.53494 > 10.140.0.11.9651: Flags [S], seq 3062495518, win 64240, options [mss 1460,sackOK,TS val 3652388473 ecr 0,nop,wscale 7], length 0
01:15:05.517455 IP 10.4.20.127.53494 > 10.140.0.11.9651: Flags [S], seq 3062495518, win 64240, options [mss 1460,sackOK,TS val 3652396665 ecr 0,nop,wscale 7], length 0
01:16:16.914453 IP 10.4.20.127.60710 > 10.140.0.11.9651: Flags [S], seq 2631151189, win 64240, options [mss 1460,sackOK,TS val 3652468062 ecr 0,nop,wscale 7], length 0
01:16:17.933435 IP 10.4.20.127.60710 > 10.140.0.11.9651: Flags [S], seq 2631151189, win 64240, options [mss 1460,sackOK,TS val 3652469081 ecr 0,nop,wscale 7], length 0
01:16:19.949444 IP 10.4.20.127.60710 > 10.140.0.11.9651: Flags [S], seq 2631151189, win 64240, options [mss 1460,sackOK,TS val 3652471097 ecr 0,nop,wscale 7], length 0
01:16:24.109413 IP 10.4.20.127.60710 > 10.140.0.11.9651: Flags [S], seq 2631151189, win 64240, options [mss 1460,sackOK,TS val 3652475257 ecr 0,nop,wscale 7], length 0
01:16:32.301591 IP 10.4.20.127.60710 > 10.140.0.11.9651: Flags [S], seq 2631151189, win 64240, options [mss 1460,sackOK,TS val 3652483449 ecr 0,nop,wscale 7], length 0
```

**Expected behavior**
For `10.140.0.11` to show up in main.log or something indication on how/why it's trying to contract this. 

**Operating System**
DISTRIB_DESCRIPTION="Ubuntu 22.04.2 LTS"
Docker version 24.0.2, build cb74dfc

**Additional context**
Any help you can provide me in regards to figuring out this problem would be great. Is there some peer auto discovery mechanism that might explain this behaviour? Those packets are always unanswered because there's no endpoints there. 

**To best protect the Avalanche community security bugs should be reported in accordance to our [Security Policy](../security/policy)**

**Comment by StephenButtolph** [comment]
Have you played around with [`--network-allow-private-ips`](https://docs.avax.network/nodes/maintain/avalanchego-config-flags#--network-allow-private-ips-bool)? The peer discovery protocol attempts to connect to IPs that a validator is reporting. If there is a validator reporting this private IP, then your node may attempt to connect to it.

**Comment by StephenButtolph** [comment]
I put up a PR to prevent this unexpected behavior in the normal (default) case. Interested on your thoughts. (would also be interested if you are able to test out the PR and see if it behaves as you'd expect.

**Comment by mark-liu** [comment]
@StephenButtolph hello, thanks for looking into this `--network-allow-private-ips` is not something I have set on the node so I guess i'm running whatever default setting the node comes with. I can set it to false and see if the behaviour goes away.

**Comment by mark-liu** [comment]
@StephenButtolph oh btw we do not have a host at that IP. Hence the confusion.

**Comment by StephenButtolph** [comment]
> `--network-allow-private-ips` is not something I have set on the node so I guess i'm running whatever default setting the node comes with. I can set it to false and see if the behaviour goes away.

Yeah - I'd be quite interested if after setting `--network-allow-private-ips=false` you still observed this behavior. In the linked PR we changed the default value of this setting from `true` to `false` for `mainnet` and `fuji` (will be included in the next release).

**Comment by mark-liu** [comment]
@StephenButtolph good news the unexpected behaviour has stopped.

**Comment by StephenButtolph** [comment]
Now that `v1.10.7` has been released and the `--network-allow-private-ips` flag seems to be fixing the issue - I'm going to close this.
